<xs:schema xmlns:xs="http://www.w3.org/2001/XMLSchema">
  <xs:element name="alumnos">
    <xs:complexType>
      <xs:sequence>
        <xs:element name="alumno" maxOccurs="unbounded">
          <xs:complexType>
            <xs:sequence>
              <xs:element name="nombre" type="xs:string"/>
              <xs:element name="edad" type="xs:int"/>
              <xs:element name="direccion" maxOccurs="2">
                <xs:complexType>
                  <xs:sequence>
                    <xs:element name="calle" type="xs:string"/>
                    <xs:element name="ciudad" type="xs:string" minOccurs="1"/>
                  </xs:sequence>
                </xs:complexType>
              </xs:element>
              <xs:element name="telefono" maxOccurs="3">
                <xs:simpleType>
                  <xs:restriction base="xs:string"/>
                </xs:simpleType>
              </xs:element>
            </xs:sequence>
            <xs:attribute name="ies" type="xs:string"/>
          </xs:complexType>
        </xs:element>
      </xs:sequence>
    </xs:complexType>
  </xs:element>
</xs:schema>
